{
  "id": "PLuhl9TnQPDCnWIhy_KSbtFwXVQnNvgfSh",
  "title": "YouTube",
  "availability": null,
  "channel_follower_count": null,
  "description": "",
  "tags": [],
  "thumbnails": [
    {
      "url": "https://i.ytimg.com/vi/lVI_J1cbFb4/hqdefault.jpg?sqp=-oaymwEWCKgBEF5IWvKriqkDCQgBFQAAiEIYAQ==&rs=AOn4CLDSFko5GVHTf22FMkOm4uTb-Pf9Dg",
      "height": 94,
      "width": 168,
      "id": "0",
      "resolution": "168x94"
    },
    {
      "url": "https://i.ytimg.com/vi/lVI_J1cbFb4/hqdefault.jpg?sqp=-oaymwEWCMQBEG5IWvKriqkDCQgBFQAAiEIYAQ==&rs=AOn4CLA8f0t8tVMqcdG1QYuh-sQ9Uc53jg",
      "height": 110,
      "width": 196,
      "id": "1",
      "resolution": "196x110"
    },
    {
      "url": "https://i.ytimg.com/vi/lVI_J1cbFb4/hqdefault.jpg?sqp=-oaymwEXCPYBEIoBSFryq4qpAwkIARUAAIhCGAE=&rs=AOn4CLBWhQYFRuvG9dqKU87pDh_sIjnRUw",
      "height": 138,
      "width": 246,
      "id": "2",
      "resolution": "246x138"
    },
    {
      "url": "https://i.ytimg.com/vi/lVI_J1cbFb4/hqdefault.jpg?sqp=-oaymwEXCNACELwBSFryq4qpAwkIARUAAIhCGAE=&rs=AOn4CLC4pN2ks4OQluY83-zIqMilztBF5A",
      "height": 188,
      "width": 336,
      "id": "3",
      "resolution": "336x188"
    }
  ],
  "modified_date": "20250123",
  "view_count": 7844062,
  "playlist_count": 4,
  "channel": "jawed",
  "channel_id": "UC4QobU6STFB0P71PMvOGN5A",
  "uploader_id": "@jawed",
  "uploader": "jawed",
  "channel_url": "https://www.youtube.com/channel/UC4QobU6STFB0P71PMvOGN5A",
  "uploader_url": "https://www.youtube.com/@jawed",
  "_type": "playlist",
  "entries": [
    {
      "_type": "url",
      "ie_key": "Youtube",
      "id": "lVI_J1cbFb4",
      "url": "https://www.youtube.com/watch?v=lVI_J1cbFb4",
      "title": "How YouTube Was Created ft. Founder Steve Chen",
      "description": null,
      "duration": 2895,
      "channel_id": "UCWrF0oN6unbXrWsTN7RctTw",
      "channel": "Sequoia Capital",
      "channel_url": "https://www.youtube.com/channel/UCWrF0oN6unbXrWsTN7RctTw",
      "uploader": "Sequoia Capital",
      "uploader_id": "@sequoiacapital",
      "uploader_url": "https://www.youtube.com/@sequoiacapital",
      "thumbnails": [
        {
          "url": "https://i.ytimg.com/vi/lVI_J1cbFb4/hqdefault.jpg?sqp=-oaymwEbCKgBEF5IVfKriqkDDggBFQAAiEIYAXABwAEG&rs=AOn4CLDg-TUHZ1M57zW4yQ5XtpIkLSspsQ",
          "height": 94,
          "width": 168
        },
        {
          "url": "https://i.ytimg.com/vi/lVI_J1cbFb4/hqdefault.jpg?sqp=-oaymwEbCMQBEG5IVfKriqkDDggBFQAAiEIYAXABwAEG&rs=AOn4CLAQqo8tz0lptrtqU6FQeYGR2yNi5w",
          "height": 110,
          "width": 196
        },
        {
          "url": "https://i.ytimg.com/vi/lVI_J1cbFb4/hqdefault.jpg?sqp=-oaymwEcCPYBEIoBSFXyq4qpAw4IARUAAIhCGAFwAcABBg==&rs=AOn4CLANNaFpdfytCqFtSPAyfU_YzzV8KA",
          "height": 138,
          "width": 246
        },
        {
          "url": "https://i.ytimg.com/vi/lVI_J1cbFb4/hqdefault.jpg?sqp=-oaymwEcCNACELwBSFXyq4qpAw4IARUAAIhCGAFwAcABBg==&rs=AOn4CLBS8Rt30uwZpg7uFmq_rJHjn6t69A",
          "height": 188,
          "width": 336
        }
      ],
      "timestamp": null,
      "release_timestamp": null,
      "availability": null,
      "view_count": 305000,
      "live_status": null,
      "channel_is_verified": null,
      "__x_forwarded_for_ip": null
    },
    {
      "_type": "url",
      "ie_key": "Youtube",
      "id": "XAJEXUNmP5M",
      "url": "https://www.youtube.com/watch?v=XAJEXUNmP5M",
      "title": "r | p 2006: YouTube: From Concept to Hypergrowth - Jawed Karim",
      "description": null,
      "duration": 3049,
      "channel_id": "UCm5h-rixlNgYL1PoFPJjYog",
      "channel": "Reflections Projections",
      "channel_url": "https://www.youtube.com/channel/UCm5h-rixlNgYL1PoFPJjYog",
      "uploader": "Reflections Projections",
      "uploader_id": "@acmuiuc",
      "uploader_url": "https://www.youtube.com/@acmuiuc",
      "thumbnails": [
        {
          "url": "https://i.ytimg.com/vi/XAJEXUNmP5M/hqdefault.jpg?sqp=-oaymwE1CKgBEF5IVfKriqkDKAgBFQAAiEIYAXABwAEG8AEB-AG-B4AC0AWKAgwIABABGE8gXihlMA8=&rs=AOn4CLDCZ6PFWLMJ-4V8ektPqDmFuoOIcw",
          "height": 94,
          "width": 168
        },
        {
          "url": "https://i.ytimg.com/vi/XAJEXUNmP5M/hqdefault.jpg?sqp=-oaymwE1CMQBEG5IVfKriqkDKAgBFQAAiEIYAXABwAEG8AEB-AG-B4AC0AWKAgwIABABGE8gXihlMA8=&rs=AOn4CLCewS2aaBqlc0_9pFDMlouysn0tjw",
          "height": 110,
          "width": 196
        },
        {
          "url": "https://i.ytimg.com/vi/XAJEXUNmP5M/hqdefault.jpg?sqp=-oaymwE2CPYBEIoBSFXyq4qpAygIARUAAIhCGAFwAcABBvABAfgBvgeAAtAFigIMCAAQARhPIF4oZTAP&rs=AOn4CLCOhCTYN_lk033itWQokJxiGrcQDQ",
          "height": 138,
          "width": 246
        },
        {
          "url": "https://i.ytimg.com/vi/XAJEXUNmP5M/hqdefault.jpg?sqp=-oaymwE2CNACELwBSFXyq4qpAygIARUAAIhCGAFwAcABBvABAfgBvgeAAtAFigIMCAAQARhPIF4oZTAP&rs=AOn4CLAB-slQi_iURBHdGWi87fFlOCzHSA",
          "height": 188,
          "width": 336
        }
      ],
      "timestamp": null,
      "release_timestamp": null,
      "availability": null,
      "view_count": 6600000,
      "live_status": null,
      "channel_is_verified": null,
      "__x_forwarded_for_ip": null
    },
    {
      "_type": "url",
      "ie_key": "Youtube",
      "id": "VaLXzI92t9M",
      "url": "https://www.youtube.com/watch?v=VaLXzI92t9M",
      "title": "First Back Flip on Youtube! (House dismount) #2005  #viralvideo",
      "description": null,
      "duration": 61,
      "channel_id": "UCs0ACZIa1m4ecu2zijr-8Sg",
      "channel": "COBALTGRUV",
      "channel_url": "https://www.youtube.com/channel/UCs0ACZIa1m4ecu2zijr-8Sg",
      "uploader": "COBALTGRUV",
      "uploader_id": "@COBALTGRUV",
      "uploader_url": "https://www.youtube.com/@COBALTGRUV",
      "thumbnails": [
        {
          "url": "https://i.ytimg.com/vi/VaLXzI92t9M/hqdefault.jpg?sqp=-oaymwEbCKgBEF5IVfKriqkDDggBFQAAiEIYAXABwAEG&rs=AOn4CLA0vbWeThYpPda1bvQtrfcIgXdPYQ",
          "height": 94,
          "width": 168
        },
        {
          "url": "https://i.ytimg.com/vi/VaLXzI92t9M/hqdefault.jpg?sqp=-oaymwEbCMQBEG5IVfKriqkDDggBFQAAiEIYAXABwAEG&rs=AOn4CLBi0D0OWf9ORAfZ4XEmWpKQ2Nwuag",
          "height": 110,
          "width": 196
        },
        {
          "url": "https://i.ytimg.com/vi/VaLXzI92t9M/hqdefault.jpg?sqp=-oaymwEcCPYBEIoBSFXyq4qpAw4IARUAAIhCGAFwAcABBg==&rs=AOn4CLAt7osjLTP9J-M9NN-MvXXfGBTudA",
          "height": 138,
          "width": 246
        },
        {
          "url": "https://i.ytimg.com/vi/VaLXzI92t9M/hqdefault.jpg?sqp=-oaymwEcCNACELwBSFXyq4qpAw4IARUAAIhCGAFwAcABBg==&rs=AOn4CLDL4KEueNjQfyTGtvWGM5nJIQc6Dw",
          "height": 188,
          "width": 336
        }
      ],
      "timestamp": null,
      "release_timestamp": null,
      "availability": null,
      "view_count": 3700000,
      "live_status": null,
      "channel_is_verified": null,
      "__x_forwarded_for_ip": null
    },
    {
      "_type": "url",
      "ie_key": "Youtube",
      "id": "jNQXAC9IVRw",
      "url": "https://www.youtube.com/watch?v=jNQXAC9IVRw",
      "title": "Me at the zoo",
      "description": null,
      "duration": 19,
      "channel_id": "UC4QobU6STFB0P71PMvOGN5A",
      "channel": "jawed",
      "channel_url": "https://www.youtube.com/channel/UC4QobU6STFB0P71PMvOGN5A",
      "uploader": "jawed",
      "uploader_id": "@jawed",
      "uploader_url": "https://www.youtube.com/@jawed",
      "thumbnails": [
        {
          "url": "https://i.ytimg.com/vi/jNQXAC9IVRw/hqdefault.jpg?sqp=-oaymwE1CKgBEF5IVfKriqkDKAgBFQAAiEIYAXABwAEG8AEB-AG-AoAC8AGKAgwIABABGFUgWShlMA8=&rs=AOn4CLD0z8RhQhBpOGg7rE1WwNmsXhJviQ",
          "height": 94,
          "width": 168
        },
        {
          "url": "https://i.ytimg.com/vi/jNQXAC9IVRw/hqdefault.jpg?sqp=-oaymwE1CMQBEG5IVfKriqkDKAgBFQAAiEIYAXABwAEG8AEB-AG-AoAC8AGKAgwIABABGFUgWShlMA8=&rs=AOn4CLDEByjISd3w-TM9Pzzz3rxWDxLQNw",
          "height": 110,
          "width": 196
        },
        {
          "url": "https://i.ytimg.com/vi/jNQXAC9IVRw/hqdefault.jpg?sqp=-oaymwE2CPYBEIoBSFXyq4qpAygIARUAAIhCGAFwAcABBvABAfgBvgKAAvABigIMCAAQARhVIFkoZTAP&rs=AOn4CLAtWrYHlO_zHK-I-52tzA86tqSeAw",
          "height": 138,
          "width": 246
        },
        {
          "url": "https://i.ytimg.com/vi/jNQXAC9IVRw/hqdefault.jpg?sqp=-oaymwE2CNACELwBSFXyq4qpAygIARUAAIhCGAFwAcABBvABAfgBvgKAAvABigIMCAAQARhVIFkoZTAP&rs=AOn4CLB7NY0fx4yZYDj27223V3b7Sowf5w",
          "height": 188,
          "width": 336
        }
      ],
      "timestamp": null,
      "release_timestamp": null,
      "availability": null,
      "view_count": 372000000,
      "live_status": null,
      "channel_is_verified": null,
      "__x_forwarded_for_ip": null
    }
  ],
  "extractor_key": "YoutubeTab",
  "extractor": "youtube:tab",
  "webpage_url": "https://www.youtube.com/playlist?list=PLuhl9TnQPDCnWIhy_KSbtFwXVQnNvgfSh",
  "original_url": "https://www.youtube.com/playlist?list=PLuhl9TnQPDCnWIhy_KSbtFwXVQnNvgfSh",
  "webpage_url_basename": "playlist",
  "webpage_url_domain": "youtube.com",
  "release_year": null,
  "epoch": 1758977752,
  "_version": {
    "version": "2025.09.26",
    "current_git_head": null,
    "release_git_head": "12b57d2858845c0c7fb33bf9aa8ed7be6905535d",
    "repository": "yt-dlp/yt-dlp"
  }
}
